,Nom,Mouvement,summary,sum_lem,mvm_label
321,Jean-Antoine_de_Baïf,pleiade,"Jean-Antoine de Baïf, né à Venise le 19 février 1532, et mort à Paris le 19 septembre 1589, est un poète français. Ami de Pierre de Ronsard et membre de la Pléiade, il se distingue comme le principal artisan de l'introduction en France d'une versification quantitative mesurée, calquée sur la poésie de l'Antiquité gréco-latine.

",Baïf naître venise 19 février 1532 mort Paris 19 septembre 1589 poète français ami Pierre Ronsard membre Pléiade distingue comme principal artisan introduction France versification quantitatif mesurer calquer poésie Antiquité,27
322,Étienne_Jodelle,pleiade,"Étienne Jodelle est un poète et dramaturge français, né en 1532 et mort en juillet de 1573 à Paris. Membre de la Pléiade, il s'efforcera de revitaliser les principes du théâtre antique à la Renaissance. Il est le premier à introduire l'alexandrin dans la tragédie à son époque, notamment avec Cléopâtre captive, la première tragédie à l'antique, ainsi que L'Eugène  dans la comédie, reconnu comme un précurseur du théâtre qui naît dans la seconde moitié du XVIe siècle, une période convulsive qui verra ses incertitudes incarnées dans son œuvre,.",Étienne Jodelle poète dramaturg français naître 1532 mort juillet 1573 Paris membre Pléiade efforcer revitaliser principe théâtre antique Renaissance il premier introduire alexandrin tragédie époque notamment Cléopâtre captif premier tragédie antique ainsi Eugène comédie reconnaître comme précurseur théâtre naître second moitié xvi siècle période convulsif voir incertitude incarner œuvre,27
323,Rémy_Belleau,pleiade,"Rémy Belleau, né à Nogent-le-Rotrou en 1528, mort à Paris le 6 mars 1577, est un poète français de la Pléiade.",Rémy Belleau naître 1528 mort Paris 6 mars 1577 poète français Pléiade,27
324,Jean_Dorat,pleiade,"Jean Dorat, en latin Auratus, dit d'Aurat, nom de plume de Jean Dinemandi, né le 3 avril 1508 à Limoges, mort le 1er novembre 1588 à Paris, est un écrivain et helléniste français.",Jean Dorat latin Auratus dire Aurat nom plume Jean Dinemandi naître 3 avril 1508 Limoges mourir premier novembre 1588 Paris écrivain helléniste français,27
325,Jacques_Peletier,pleiade,"Jacques Peletier du Mans, ou Pelletier, né au Mans le 25 juillet 1517, mort à Paris en 1582 ou 1583, est un mathématicien, médecin, grammairien et un poète humaniste français, membre de la Pléiade. 
Il est un des premiers avec Guillaume Gosselin à user de lettres en algèbre pour résoudre les systèmes d'équations linéaires. Préfigurant la logistique spécieuse, ses notations et ses exigences de fonder de façon abstraite les mathématiques font de lui un précurseur immédiat de François Viète.",Jacques Peletier Mans Pelletier naître Mans 25 juillet 1517 mort Paris 1582 1583 mathématicien médecin grammairien poète humaniste français membre Pléiade il premier Guillaume Gosselin user lettre algèbre résoudre système équation linéaire préfigurer logistique spécieux notation exigence fonder façon abstraire mathématique faire précurseur immédiat François Viète,27
326,Pontus_de_Tyard,pleiade,"Pontus de Tyard, seigneur de Bissy, est un prélat, écrivain et poète français, membre du cercle littéraire de la Pléiade.",Pontus Tyard seigneur Bissy prélat écrivain poète français membre cercle littéraire Pléiade,27
327,Al-Hamadhani,picaresque,"Ahmad Al-Hamadhânî, surnommé Badî' al-Zamân, « le Prodige du Siècle » (en arabe : أحمد بديع الزمان الهمذاني), est un écrivain et épistolier arabo-persan né à Hamadan en 967, 968 ou 969 et mort à 40 ans, à Hérat en 1007. Il est l'inventeur du genre littéraire de la maqâma.",Ahmad Al Hamadhânî surnommer Badî al Zamân prodige siècle arabe أحمد بديع الزمان الهمذاني écrivain épistolier naître Hamadan 967 968 969 mort 40 an hérat 1007 il inventeur genre littéraire maqâma,26
328,Mateo_Alemán,picaresque,"Mateo Alemán (né à Séville en septembre 1547 et mort au Mexique vers 1614) est un écrivain espagnol, surtout connu comme auteur du célèbre roman picaresque Guzman d'Alfarache.",Mateo Alemán naître Séville septembre 1547 mort Mexique vers 1614 écrivain espagnol surtout connaître comme auteur célèbre roman picaresque guzman Alfarache,26
329,Pechon_de_Ruby,picaresque,"Pechon de Ruby est le pseudonyme choisi par l'auteur inconnu d'un livret publié à Lyon en 1596 et intitulé La Vie genereuse des Mercelots, Gueuz et Boesmiens.
Il s'agit du premier ouvrage qui, en France, ait été consacré entièrement à la vie des vagabonds et du premier récit français de type picaresque à la première personne du singulier, présenté par l'auteur comme étant autobiographique.
C'est aussi le plus important recueil lexicographique en France de jargon attribué aux merciers et aux mendiants (146 entrées pour environ 160 termes, parfois très fantaisistes), avant celui donné par Ollivier Chereau en 1629-1630 dans son Jargon ou Langage de l'Argot reformé (236 entrées pour environ 260 termes, parfois très fantaisistes) et qui repose en grande partie sur celui de Pechon de Ruby, probablement dans l'édition troyenne de 1627 de la Vie genereuse.
Une réédition bibliophilique citée par la Bibliothèque nationale de France a été réalisée à Rouen en 1952 par le graveur Émile-Henry Tilmans qui l'a illustrée de ses propres eaux-fortes.",pechon Ruby pseudonyme choisir auteur inconnu livret publier Lyon 1596 intituler le vie genereus mercelot Gueuz Boesmiens il agir premier ouvrage France consacrer entièrement vie vagabond premier récit français type picaresque premier personne singulier présenter auteur comme autobiographique aussi plus important recueil lexicographique France jargon attribué mercier mendiant 146 entrée environ 160 terme parfois très fantaisiste avant celui donner Ollivier Chereau 1629 1630 jargon langage argot reformer 236 entrée environ 260 terme parfois très fantaisiste repose grand partie celui Pechon Ruby probablement édition troyen 1627 vie genereus un réédition bibliophilique citer bibliothèque national France avoir réaliser Rouen 1952 graveur Émile Henry Tilmans avoir illustrer propre eau fort,26
330,Vicente_Espinel,picaresque,"Vicente Gómez Martínez-Espinel, né le 28 décembre 1550 à Ronda et mort le 4 février 1624, est un écrivain, poète et musicien espagnol du Siècle d'or espagnol.",Vicente Gómez Martínez Espinel naître 28 décembre 1550 Ronda mort 4 février 1624 écrivain poète musicien espagnol siècle or espagnol,26
331,Francisco_de_Quevedo,picaresque,"Francisco Gómez de Quevedo Villegas y Santibáñez Cevallos, né probablement le 14 septembre 1580 à Madrid et mort le 8 septembre 1645 à Villanueva de los Infantes, province de Ciudad Real, est un écrivain espagnol du Siècle d’or, dont il est l’une des figures les plus importantes et les plus complexes de la littérature.",Francisco Gómez Quevedo Villegas Santibáñez Cevallos naître probablement 14 septembre 1580 Madrid mort 8 septembre 1645 villanueva lo infant province Ciudad Real écrivain espagnol siècle or dont figure plus important plus complexe littérature,26
332,Luis_Vélez_de_Guevara,picaresque,"Luís Vélez de Guevara, né en 1579 à Ecija et mort le 10 novembre 1644 à Madrid, est un auteur dramatique et romancier du Siècle d'or espagnol.",Luís véler Guevara naître 1579 ecija mort 10 novembre 1644 Madrid auteur dramatique romancier siècle or espagnol,26
333,Alonso_de_Castillo_Solórzano,picaresque,"Alonso del Castillo Solorzano (Tordesillas, 1er octobre 1584-Saragosse ou Palerme, v.1648) est un écrivain espagnol.",Alonso del Castillo Solorzano Tordesillas premier octobre Palerme écrivain espagnol,26
334,Hans_Jakob_Christoffel_von_Grimmelshausen,picaresque,"Hans Jakob Christoffel von Grimmelshausen (22 juin 1622 - 17 août 1676), écrivain allemand, est né à Gelnhausen en Hesse et mort à Renchen dans le Bade-Wurtemberg, à une vingtaine de kilomètres de Strasbourg.",Hans Jakob Christoffel von Grimmelshausen 22 juin 1622 17 août 1676 écrivain allemand naître Gelnhausen Hesse mort Renchen Bade Wurtemberg vingtaine kilomètre Strasbourg,26
335,Alain-René_Lesage,picaresque,"Alain-René Lesage ou Le Sage, né à Sarzeau le 8 mai 1668 et mort à Boulogne-sur-Mer le 17 novembre 1747, est un romancier et auteur dramatique français surtout connu comme auteur du roman picaresque Histoire de Gil Blas de Santillane.",Alain René Lesage le Sage naître Sarzeau 8 mai 1668 mort 17 novembre 1747 romancier auteur dramatique français surtout connaître comme auteur roman picaresque histoire Gil Blas Santillane,26
336,Daniel_Defoe,picaresque,"Daniel Defoe, de son vrai nom Daniel Foe, est un aventurier, commerçant, agent politique et écrivain anglais, né vers 1660 à Londres et mort le 24 avril 1731 dans la Cité de Londres. Il est notamment connu pour être l’auteur de Robinson Crusoé et de Heurs et malheurs de la fameuse Moll Flanders.",Daniel Defoe vrai nom Daniel Foe aventurier commerçant agent politique écrivain anglais naître vers 1660 Londres mort 24 avril 1731 cité Londres il notamment connaître être auteur Robinson Crusoé heur malheur fameux moll flander,26
337,Pierre_Carlet_de_Chamblain_de_Marivaux,picaresque,"Marivaux (né Pierre Carlet) est un écrivain français, baptisé à Paris le 8 février 1688 et mort à Paris le 12 février 1763.
Surtout connu pour son théâtre et attaché aux Comédiens italiens, Marivaux fut aussi romancier et journaliste, toujours spectateur solitaire d'une société en pleine transformation.
Il est élu à l'Académie française en 1742. Au 1er septembre 2009, il est le 5e auteur le plus joué par la Comédie-Française.",marivaux naître Pierre Carlet écrivain français baptiser Paris 8 février 1688 mort Paris 12 février 1763 surtout connaître théâtre attacher comédien italien Marivaux aussi romancier journaliste toujours spectateur solitaire société pleine transformation il élire académie français 1742 au premier septembre 2009 cinquième auteur plus jouer Comédie Française,26
338,Henry_Fielding,picaresque,"Henry Fielding, né le 22 avril 1707 à Sharpham Park près de Glastonbury, dans le Somerset (Angleterre), et mort le 8 octobre 1754 à Lisbonne, est un dramaturge, poète, essayiste et romancier anglais.
Fielding fréquente le Collège d'Eton puis l'université de Leyde aux Pays-Bas comme étudiant en lettres.
Pendant de longues années, il se consacre au théâtre et ses pièces font bientôt de lui l'un des dramaturges les plus célèbres de la capitale britannique. C'est seulement en 1741 qu'il entre en fiction avec Shamela, parodie du très populaire Paméla ou la Vertu récompensée (1740-1741) de Richardson, puis avec Joseph Andrews. Le sommet de son œuvre est sans doute atteint avec l’Histoire de Tom Jones, enfant trouvé.
L'ironie est souveraine chez Fielding, en harmonie avec l'époque, l'âge d'or du genre. Ce style bien particulier, parfois appelé « oblique », vise autant l'auteur que son narrateur, ses lecteurs et ses personnages. Tous les procédés techniques sont utilisés selon une savante rhétorique qu'appuie une solide érudition classique, encore que des erreurs de citations soient parfois commises, mais à dessein, pour mieux taquiner le lecteur inattentif quelques chapitres plus loin.
Il existe de multiples facettes à la personnalité de Fielding, à sa carrière, à son œuvre. Personnage important dans le Londres de la première moitié du XVIIIe siècle, tant par ses activités de magistrat que par ses publications, il n'a vécu que quarante-sept ans, a connu la misère et la gloire, le bonheur et le deuil, la calomnie et le panégyrique. Il a été attaqué, vilipendé, censuré et encensé, mais il a vécu avec la certitude que ses œuvres seraient reconnues par la postérité. De fait, Walter Scott l'a appelé « le père du roman anglais » (the father of the English novel), et selon Somerset Maugham, son Histoire de Tom Jones, enfant trouvé figure parmi les dix meilleurs romans jamais écrits ; de récents sondages conduits par The Guardian confirment cette faveur du public.",Henry Fielding naître 22 avril 1707 Sharpham Park près Glastonbury somerset Angleterre mort 8 octobre 1754 Lisbonne dramaturge poète essayiste romancier anglais Fielding fréquent collège Eton puis université Leyde Pays Bas comme étudier lettre pendant long année consacre théâtre pièce faire bientôt dramaturge plus célèbre capitale britannique seulement 1741 entre fiction Shamela parodie très populaire paméla vertu récompenser 1740 1741 Richardson puis Joseph Andrews le sommet œuvre sans doute atteindre histoire Tom Jones enfant trouver ironie souverain chez Fielding harmonie époque âge or genre ce style bien particulier parfois appeler oblique vise autant auteur narrateur lecteur personnage tout procédé technique utiliser selon savant rhétorique appuie solide érudition classique encore erreur citation parfois commettre dessein mieux taquiner lecteur inattentif quelque chapitre plus loin il existe multiple facette personnalité Fielding carrière œuvre personnage important Londres premier moitié xviii siècle tant activité magistrat publication avoir vivre quarante sept an avoir connaître misère gloire bonheur deuil calomnie panégyrique il avoir attaquer vilipender censuré encensé avoir vivre certitude œuvre reconnaître postérité de fait walter Scott avoir appeler père roman anglais the father of the English novel selon somerset Maugham histoire Tom Jones enfant trouver figure parmi dix meilleur roman jamais écrire récent sondage conduit The Guardian confirmer ce faveur public,26
339,Jean_Potocki,picaresque,"Jan Potocki armoiries Pilawa, né à Pików le 8 mars 1761 et mort  le 2 décembre 1815 à Uładówka près de Pików, en Podolie alors polonaise, est un aristocrate, savant et écrivain polonais. Grand voyageur, historien, archéologue et ethnologue, éditeur, fondateur de Wolna Drukarnia (Imprimerie libre) en 1788, il est surtout connu comme auteur du Manuscrit trouvé à Saragosse.",Jan Potocki armoirie Pilawa naître Pików 8 mars 1761 mourir 2 décembre 1815 uładówker près Pików Podolie alors polonais aristocrate savant écrivain polonais grand voyageur historien archéologu ethnologue éditeur fondateur Wolna Drukarnia imprimerie libre 1788 surtout connaître comme auteur Manuscrit trouver Saragosse,26
340,William_Makepeace_Thackeray,picaresque,"William Makepeace Thackeray (18 juillet 1811, Alipur, Calcutta - 24 décembre 1863, Londres) est l'un des romanciers britanniques les plus importants de l'époque victorienne. Connu pour ses œuvres satiriques prenant pour cible la bourgeoisie britannique, il est l'auteur, entre autres, des Mémoires de Barry Lyndon, qui fut adapté par le cinéaste Stanley Kubrick et de Vanity Fair, l'un des romans-phares de la littérature anglaise.",William makepeace Thackeray 18 juillet 1811 Alipur Calcutta 24 décembre 1863 Londres romancier britannique plus important époque victorien connaître œuvre satirique prendre cible bourgeoisie britannique auteur entre autre mémoire Barry Lyndon adapter cinéaste Stanley Kubrick Vanity fair roman phare littérature anglais,26
341,Jack_Vance,picaresque,"John Holbrook Vance, dit Jack Vance, né le 28 août 1916 à San Francisco et mort le 26 mai 2013 à Oakland,, est un auteur américain de science-fiction et de fantasy. Hormis Jack Vance, il utilise souvent des pseudonymes — Peter Held, John Holbrook, John van See, Alan Wade — pour signer son travail. Il écrira même sous le nom d'Ellery Queen trois romans : The Madman Theory, The Four Johnset A Room to Die in.",John Holbrook vance dit Jack Vance naître 28 août 1916 San Francisco mort 26 mai 2013 Oakland auteur américain science fiction fantasy Hormis Jack Vance utilise souvent pseudonyme Peter Held John Holbrook John van See Alan Wade signer travail il écrire sous nom Ellery Queen trois roman The Madman Theory The Four Johnset a room to Die in,26
342,Jack_Kerouac,picaresque,"Jean-Louis Kérouac ou Jean-Louis Lebris de Kérouac dit Jack Kerouac /ʒak ke.ʁwak (en anglais : /dʒæk ˈkɛɹuæk/), né le 12 mars 1922 à Lowell dans le Massachusetts et mort le 21 octobre 1969 à St. Petersburg en Floride, est un écrivain et poète américain.
Considéré comme l'un des auteurs américains les plus importants du XXe siècle, il est même pour la communauté beatnik le « King of the Beats ». Son style rythmé et immédiat, auquel il donne le nom de « prose spontanée », a inspiré de nombreux artistes et écrivains et en premier lieu les chanteurs américains Tom Waits et Bob Dylan. Les œuvres les plus connues de Kerouac, Sur la route (considéré comme le manifeste de la Beat Generation), Les Clochards célestes, Big Sur ou Le Vagabond solitaire, narrent de manière romancée ses voyages à travers les États-Unis. Le genre cinématographique du road movie est directement influencé par ses techniques et par son mode de narration.
Jack Kerouac a passé la majeure partie de sa vie partagé entre les grands espaces américains et l'appartement de sa mère. Ce paradoxe est à l'image de son mode de vie : confronté aux changements rapides de son époque, il a éprouvé de profondes difficultés à trouver sa place dans le monde, ce qui l'a amené à rejeter les valeurs traditionnelles des années 1945-1950, donnant ainsi naissance au mouvement beat. Ses écrits reflètent cette volonté de se libérer des conventions sociales étouffantes de son époque et de donner un sens à son existence. Un sens qu'il a cherché dans des drogues comme la marijuana et la benzédrine, dans l'alcool également, dans la religion et la spiritualité — notamment le bouddhisme — et dans une frénésie de voyages.
« Jazz poet », comme il se définit lui-même, Kerouac vante les bienfaits de l'amour, proclame l'inutilité du conflit armé, quel qu'il soit, et considère que « seuls les gens amers dénigrent la vie ». Jack Kerouac et ses écrits sont vus comme précurseurs du mode de vie de la jeunesse des années 1960, celle de la Beat Generation, « qui a ébranlé la société américaine dans ses certitudes. Elle a directement inspiré aussi bien les mouvements de mai 1968 que l’opposition à la guerre du Viêt Nam, ou les hippies de Berkeley et Woodstock. Pourtant la Beat Generation a aussi contribué à enrichir le mythe américain. Sur la route, le roman le plus connu de Kerouac, est une ode aux grands espaces, à l’épopée vers l’ouest, à la découverte de mondes nouveaux ».",Kérouac Lebris Kérouac dire Jack Kerouac anglais naître 12 mars 1922 Lowell Massachusetts mort 21 octobre 1969 Petersburg floride écrivain poète américain considérer comme auteur américain plus important xx siècle communauté beatnik King of the Beats son style rythmer immédiat auquel donne nom pros spontanée avoir inspirer nombreux artiste écrivain premier lieu chanteur américain Tom Waits Bob Dylan le œuvre plus connu Kerouac sur route considérer comme manifeste beat Generation le clochard céleste Big sur le Vagabond solitaire narrent manière romancer voyage travers le genre cinématographique road movi directement influencer technique mode narration Jack Kerouac avoir passer majeur partie vie partager entre grand espace américain appartement mère ce paradoxe image mode vie confronté changement rapide époque avoir éprouver profonde difficulté trouver place monde avoir amener rejeter valeur traditionnel année 1945 1950 donner ainsi naissance mouvement beat son écrit refléter ce volonté libérer convention social étouffant époque donner sens existence un sens avoir chercher drogue comme marijuana benzédrine alcool également religion spiritualité notamment bouddhisme frénésie voyage Jazz poet comme définir Kerouac ver bienfait amour proclame inutilité conflit armer quel considérer seul gens amer dénigrer vie Jack Kerouac écrit voir comme précurseur mode vie jeunesse année 1960 celui Beat Generation avoir ébranler société américain certitude lui avoir directement inspirer aussi bien mouvement mai 1968 opposition guerre Viêt Nam hippie Berkeley Woodstock pourtant beat generation avoir aussi contribuer enrichir mythe américain sur route roman plus connaître Kerouac ode grand espace épopée vers ouest découverte monde nouveau,26
343,Frédérick_Tristan,picaresque,"Jean-Paul Baron, dit Frédérick Tristan, est un écrivain et poète français, né le 11 juin 1931 à Sedan. Il a remporté le prix Goncourt en 1983 et le Grand prix de littérature de la Société des Gens de Lettres en 2000. Il est également connu sous les pseudonymes de Danielle Sarréra et de Mary London.",Baron dire frédérick Tristan écrivain poète français naître 11 juin 1931 Sedan il avoir remporter prix Goncourt 1983 grand prix littérature Société gens lettre 2000 il également connaître sous pseudonyme Danielle Sarréra Mary London,26
344,T._C._Boyle,picaresque,"T. C. Boyle (Tom Coraghessan Boyle, nom de plume de Thomas John Boyle) est un écrivain et romancier américain né le 2 décembre 1948 à Peekskill, dans l'État de New York.",Boyle Tom Coraghessan Boyle nom plume Thomas John Boyle écrivain romancier américain naître 2 décembre 1948 Peekskill état New York,26
345,Arto_Paasilinna,picaresque,"Arto Paasilinna (/ˈɑr.to ˈpɑː.si.ˈlin.nɑ/), né le 20 avril 1942 à Kittilä et mort le 15 octobre 2018 à Espoo, est un écrivain, journaliste et poète finlandais de langue finnoise. 
Il est l’auteur de trente-cinq romans traduits en plus de vingt-sept langues (dont dix-huit en français en date du mois de février 2018). Il est également scénariste pour le cinéma, la radio et la télévision.
Arto Paasilinna est, avec Mika Waltari et Sofi Oksanen, un des écrivains finlandais les plus connus dans le monde.",Arto Paasilinna naître 20 avril 1942 Kittilä mort 15 octobre 2018 Espoo écrivain journaliste poète finlander langue finnois il auteur roman traduire plus langue dont français date mois février 2018 il également scénarist cinéma radio télévision Arto Paasilinna Mika Waltari Sofi Oksanen écrivain finlander plus connaître monde,26
346,Mikho_Mossoulichvili,picaresque,"Mikho Mossoulichvili (en géorgien : მიხო მოსულიშვილი), né le 10 décembre 1962, est un écrivain, dramaturge et scénariste géorgien.",mikho Mossoulichvili géorgien მიხო მოსულიშვილი naître 10 décembre 1962 écrivain dramaturge scénarist géorgien,26
347,Tobias_Smollett,picaresque,"Tobias George Smollett, baptisé le 19 mars 1721 à Cardross et mort le 17 septembre 1771  à Livourne, est un romancier écossais, connu surtout pour ses romans picaresques.",Tobias George Smollett baptiser 19 mars 1721 Cardross mort 17 septembre 1771 Livourne romancier écossais connaître surtout roman picaresque,26
348,Agrippa_d'Aubigné,baroque,"Théodore Agrippa d'Aubigné, né d’Aubigny le 8 février 1552 au château de Saint-Maury près de Pons, et mort le 9 mai 1630 à Genève, est un homme de guerre, écrivain controversiste et poète baroque français. Il est notamment connu pour Les Tragiques, poème héroïque racontant les persécutions subies par les protestants.
Calviniste intransigeant, il soutient sans relâche le parti protestant, se mettant souvent en froid avec le roi Henri de Navarre, dont il fut l'un des principaux compagnons d'armes. Après la conversion de celui-ci, il rédigea des textes qui avaient pour but d'accuser Henri IV de trahison envers l'Église. Chef de guerre, il s'illustra par ses exploits militaires et son caractère emporté et belliqueux. Ennemi acharné de l'Église romaine, ennemi de la cour de France et souvent indisposé à l'égard des princes, il s'illustra par sa violence, ses excès et ses provocations verbales.",Théodore Agrippa aubigné naître aubigny 8 février 1552 château près Pons mort 9 mai 1630 Genève homme guerre écrivain controversist poète baroque français il notamment connaître le tragique poème héroïque raconter persécution subir protestant calviniste intransigeer soutenir sans relâche parti protestant mettre souvent froid roi Henri Navarre dont principal compagnon arme après conversion rédiger texte but accuser Henri iv trahison envers église chef guerre illustrer exploit militaire caractère emporté belliqueux ennemi acharné église romain ennemi cour France souvent indisposer égard prince illustrer violence excès provocation verbal,14
349,Jean_de_Lannel,baroque,"Jean de Lannel, sieur du Chaintreau et du Chambort, né au XVIe siècle à Gap et mort après 1630, est un historien et romancier français.",Jean Lannel sieur chaintreau Chambort naître xvi siècle Gap mort après 1630 historien romancier français,14
350,Antoine-André_Mareschal,baroque,"André Mareschal, né en 1601 ou 1605 et mort vers 1648, est un poète et auteur de théâtre français.",André Mareschal naître 1601 1605 mourir vers 1648 poète auteur théâtre français,14
351,Paul_Scarron,baroque,"Paul Scarron, écuyer et seigneur de Fougerest, Beauvais et La Rivière né le 4 juillet 1610 à Paris et décédé le 6 octobre 1660 à Paris, est un écrivain français contemporain du règne de Louis XIII et du début de celui de Louis XIV. Son ouvrage le plus connu est Le Roman comique.",Paul Scarron écuyer seigneur Fougerest beauvai le rivière naître 4 juillet 1610 Paris décédé 6 octobre 1660 Paris écrivain français contemporain règne Louis xiii début celui Louis xiv son ouvrage plus connaître le roman comique,14
