,Nom,Mouvement,summary,sum_lem,mvm_label
435,Jean-Jacques_Rousseau,Lumieres,"Jean-Jacques Rousseau, né le 28 juin 1712 à Genève et mort le 2 juillet 1778 à Ermenonville, est un écrivain, philosophe et musicien genevois francophone. Orphelin de mère très jeune, sa vie est marquée par l'errance. Si ses livres et lettres connaissent à partir de 1749 un fort succès, ils lui valent aussi des conflits avec l'Église catholique et Genève qui l'obligent à changer souvent de résidence et alimentent son sentiment de persécution. 
Dans le domaine littéraire, Jean-Jacques Rousseau connaît un grand succès avec le roman épistolaire Julie ou la Nouvelle Héloïse (1761), un des plus gros tirages du XVIIIe siècle. Cet ouvrage séduit ses lecteurs d'alors par sa peinture préromantique du sentiment amoureux et de la nature. Dans Les Confessions (rédigées entre 1765 et 1770, avec publication posthume en 1782 et 1789) et dans Les Rêveries du promeneur solitaire (écrites en 1776-78, publiées en 1782), Rousseau se livre à une observation approfondie de ses sentiments intimes. L'élégance de l'écriture de Rousseau provoque une transformation significative de la poésie et de la prose françaises en les libérant des normes rigides venues du Grand Siècle.
Dans le domaine philosophique, la lecture en 1749 de la question mise au concours par l'Académie de Dijon : « le rétablissement des sciences et des arts a-t-il contribué à épurer ou à corrompre les mœurs ? » provoque ce qu'on appelle « l'illumination de Vincennes ». De là naissent les ouvrages qui inscrivent durablement Rousseau dans le monde de la pensée : le Discours sur les sciences et les arts (1750), le Discours sur l'origine et les fondements de l'inégalité parmi les hommes (1755) et Du contrat social (1762).
La philosophie politique de Rousseau est bâtie autour de l'idée que l'Homme est naturellement bon et que la société le corrompt. Par « naturellement bon », Rousseau entend que l'être humain à l'état de nature a peu de désirs, de sorte qu'il est plus farouche que méchant. Ce sont les interactions avec les autres individus qui rendent les êtres humains « méchants » et conduisent à l'accroissement des inégalités. Pour retrouver une bonté naturelle, l'homme doit avoir recours à l'artifice du contrat social et être gouverné par des lois découlant de la volonté générale exprimée par le peuple. Pour Rousseau, contrairement à ce que pense par exemple Diderot, la volonté générale n'est pas universelle, elle est propre à un État, à un corps politique particulier. Rousseau est le premier à conférer la souveraineté au peuple. En cela, on peut dire que c'est un des penseurs de la démocratie (et notamment de la démocratie directe) même s'il est favorable à ce qu'il nomme l'aristocratie élective ou le gouvernement tempéré dans le domaine du pouvoir exécutif.
Rousseau est critique par rapport à la pensée politique et philosophique développée par Hobbes et Locke. Pour lui, les systèmes politiques basés sur l'interdépendance économique et sur l'intérêt conduisent à l'inégalité, à l'égoïsme et finalement à la société bourgeoise (un terme qu'il est un des premiers à employer). Toutefois, s'il est critique de la philosophie des Lumières, il s'agit d'une critique interne. En effet, il ne veut revenir ni à Aristote, ni à l'ancien républicanisme ou à la moralité chrétienne.
La philosophie politique de Rousseau exerce une influence considérable lors de la période révolutionnaire durant laquelle son livre le Contrat social est « redécouvert ». À plus long terme, Rousseau marque le mouvement républicain français ainsi que la philosophie allemande. Par exemple, l'impératif catégorique de Kant est imprégné par l'idée rousseauiste de volonté générale. Durant une partie du XXe siècle, une controverse opposera ceux qui estiment que Rousseau est en quelque sorte le père des totalitarismes et ceux qui l'en exonèrent.
Selon Claude Lévi-Strauss, Rousseau est le premier véritable fondateur de l'anthropologie, notamment car ce dernier aurait par son universalisme posé « en termes presque modernes » le problème du passage de la nature à la culture. L'historien Léon Poliakov ajoute que Rousseau invitait ses contemporains à faire des voyages dans les pays lointains, afin d'y « étudier, non toujours des pierres et des plantes, mais une fois les hommes et les mœurs ».
Son corps est transféré au Panthéon de Paris en 1794.",Rousseau naître 28 juin 1712 Genève mort 2 juillet 1778 Ermenonville écrivain philosophe musicien genevois francophone Orphelin mère très jeune vie marquer errance si livre lettre connaître partir 1749 fort succès valoir aussi conflit église catholique Genève obligent changer souvent résidence alimenter sentiment persécution dans domaine littéraire Rousseau connaître grand succès roman épistolaire Julie Nouvelle Héloïse 1761 plus gros tirage xviii siècle ce ouvrage séduit lecteur alors peinture préromantique sentiment amoureux nature dans le confession rédiger entre 1765 1770 publication posthume 1782 1789 le rêverie promeneur solitaire écrite 1776 78 publier 1782 Rousseau livre observation approfondie sentiment intime élégance écriture Rousseau provoque transformation significatif poésie prose français libérant norme rigides venue grand siècle dans domaine philosophique lecture 1749 question mettre concours académie Dijon rétablissement science art avoir contribuer épurer corrompre mœur provoque appeler illumination Vincennes de là naissent ouvrage inscrire durablement Rousseau monde pensée discours science art 1750 discours origine fondement inégalité parmi homme 1755 de contrat social 1762 le philosophie politique Rousseau bâtir autour idée homme naturellement bon société corrompt par naturellement bon Rousseau entendre être humain état nature avoir peu désir sorte plus farouche méchant ce interaction autre individu rendre être humain méchant conduisent accroissement inégalité pour retrouver bonté naturel homme devoir avoir recours artifice contrat social être gouverner loi découlant volonté général exprimer peuple pour Rousseau contrairement pense exemple diderot volonté général universel propre état corps politique particulier rousseau premier conférer souveraineté peuple en cela pouvoir dire penseur démocratie notamment démocratie direct favorable nomme aristocratie électif gouvernement tempérer domaine pouvoir exécutif rousseau critique rapport pensée politique philosophique développer Hobbes Locke pour système politique baser interdépendance économique intérêt conduisent inégalité égoïsme finalement société bourgeois terme premier employer toutefois critique philosophie lumière agir critique interne en effet vouloir revenir ni aristote ni ancien républicanisme moralité chrétien le philosophie politique Rousseau exercer influence considérable lors période révolutionnaire durant lequel livre contrat social redécouvrir à plus long terme Rousseau marque mouvement républicain français ainsi philosophie allemand par exemple impératif catégorique Kant imprégner idée rousseauiste volonté général durant partie xx siècle controverse opposer celui estimer rousseau quelque sorte père totalitarisme celui exonèrent selon Claude Lévi Strauss Rousseau premier véritable fondateur anthropologie notamment car dernier universalisme poser terme presque moderne problème passage nature culture historien Léon Poliakov ajout Rousseau inviter contemporain faire voyage pays lointain afin étudier non toujours pierre plante fois homme mœur son corps transférer panthéon Paris 1794,6
436,Paul_Alexis,Naturalisme,"Antoine Joseph Paul Alexis, né à Aix-en-Provence le 16 juin 1847 et mort à Levallois-Perret le 28 juillet 1901, est un romancier, auteur dramatique et critique d'art français.

",Antoine Joseph Paul Alexis naître 16 juin 1847 mort Levallois Perret 28 juillet 1901 romancier auteur dramatique critique art français,7
437,Ludwig_Anzengruber,Naturalisme,"Ludwig Anzengruber (né le 29 novembre 1839 à Alservorstadt devenu un quartier de Vienne, mort le 10 décembre 1889 à Vienne) est un écrivain autrichien, l'un des dramaturges les plus populaires de son temps dans la lignée de Johann Nestroy et Ferdinand Raimund.",Ludwig Anzengruber naître 29 novembre 1839 Alservorstadt devenir quartier Vienne mourir 10 décembre 1889 Vienne écrivain autrichien dramaturge plus populaire temps lignée Johann Nestroy Ferdinand Raimund,7
438,Henry_Becque,Naturalisme,"Henry-François Becque est un dramaturge français né à Paris (3e) le 18 avril 1837 et mort à Neuilly-sur-Seine le 12 mai 1899,. 
Considéré comme le créateur du « théâtre cruel », il est connu pour un drame réaliste grinçant, Les Corbeaux (1882), et une comédie, La Parisienne (1885).
Il est le neveu du dramaturge et librettiste Pierre-Michel Martin dit Lubize (1798-1863).

",Henry François Becque dramaturge français naître Paris troisième 18 avril 1837 mort 12 mai 1899 considérer comme créateur théâtre cruel connaître drame réaliste grinçant le corbeau 1882 comédie le Parisienne 1885 il neveu dramaturge librettiste Martin dit Lubize 1798 1863,7
439,Paul_Bonnetain,Naturalisme,"Paul Bonnetain (né à Nîmes en France le 4 aout 1858 et mort à Khong (Laos) le 13 mars 1899) est un journaliste et un écrivain naturaliste dont l'écriture a été fortement marquée par les voyages exotiques. Dans les dernières années de sa vie, il fit carrière dans l'Administration coloniale (Soudan français et Laos) sans pour autant abandonner la littérature.",Paul Bonnetain naître Nîmes France 4 aout 1858 mort Khong Laos 13 mars 1899 journaliste écrivain naturaliste dont écriture avoir fortement marquer voyage exotique dans dernier année vie faire carrière administration colonial Soudan français Laos sans autant abandonner littérature,7
440,Henry_Céard,Naturalisme,"Henry Céard, né à Bercy le 18 novembre 1851 et mort à Paris le 16 août 1924, est un romancier, poète, auteur dramatique et critique littéraire français. Écrivain naturaliste, il fut un ami proche d'Émile Zola jusqu'à l'affaire Dreyfus.

",Henry Céard naître Bercy 18 novembre 1851 mort Paris 16 août 1924 romancier poète auteur dramatique critique littéraire français écrivain naturaliste ami proche Émile Zola affaire Dreyfus,7
441,Hermann_Conradi,Naturalisme,"Hermann Conradi (né le 12 juillet 1862 à Jeßnitz, mort le 8 mars 1890 à Wurtzbourg) est un écrivain naturaliste allemand.",Hermann Conradi naître 12 juillet 1862 Jeßnitz mourir 8 mars 1890 Wurtzbourg écrivain naturaliste allemand,7
442,Alphonse_Daudet,Naturalisme,"Alphonse Daudet, né le 13 mai 1840 à Nîmes et mort le 16 décembre 1897 à Paris, est un écrivain et auteur dramatique français.",alphonse Daudet naître 13 mai 1840 Nîmes mort 16 décembre 1897 Paris écrivain auteur dramatique français,7
443,Lucien_Descaves,Naturalisme,"Lucien Descaves, né le 18 mars 1861 à Paris 14e et mort le 6 septembre 1949 à Paris 16e, est un écrivain naturaliste et libertaire.
Journaliste, romancier et auteur dramatique français, il a fait partie des premiers membres de l'Académie Goncourt et en fut le président.
En 1889, il est l’auteur de Sous-offs, ouvrage antimilitariste qui lui vaut des poursuites judiciaires.",Lucien Descaves naître 18 mars 1861 Paris 14e mort 6 septembre 1949 Paris 16 écrivain naturaliste libertaire journaliste romancier auteur dramatique français avoir faire partie premier membre académie Goncourt président en 1889 auteur ouvrage antimilitariste valoir poursuite judiciaire,7
444,Louis_Marie_Desprez,Naturalisme,"Louis Marie Desprez, né le 20 juin 1861 à Chaumont en Haute-Marne, et mort le 6 décembre 1885 à Rouvres-sous-Lignol dans l'Aube, est un écrivain naturaliste français.",Louis Marie Desprez naître 20 juin 1861 Chaumont mourir 6 décembre 1885 Aube écrivain naturaliste français,7
445,Theodore_Dreiser,Naturalisme,"Theodore Herman Albert Dreiser (27 août 1871, Terre Haute, Indiana, États-Unis - 28 décembre 1945, Hollywood, Californie, États-Unis) est un écrivain naturaliste américain.",Theodore herman Albert dreiser 27 août 1871 terre Haute Indiana 28 décembre 1945 Hollywood Californie écrivain naturaliste américain,7
446,Léon_Duvauchel,Naturalisme,Léon Duvauchel né à Paris le 19 avril 1848 et mort dans la même ville le 20 juin 1902 est un écrivain régionaliste français de l'école naturaliste.,Léon Duvauchel naître Paris 19 avril 1848 mort ville 20 juin 1902 écrivain régionaliste français école naturaliste,7
447,Frères_Goncourt,Naturalisme,"Les frères Goncourt, Edmond de Goncourt (1822-1896) et Jules de Goncourt (1830-1870), sont deux écrivains français du XIXe siècle classés dans l'école naturaliste. Ils ont écrit en collaboration des romans comme Germinie Lacerteux, en 1865, roman qui s'inspire de la double vie de leur servante, ou La Lorette et L'Art du XVIIIe siècle (1859-1875). Ils détestent la philanthropie et la « bien-pensance », aiment Saint-Simon, le Père Duchesne, les mémorialistes (Chateaubriand).",le frère Goncourt Edmond Goncourt 1822 1896 Jules Goncourt 1830 1870 deux écrivain français xix siècle classer école naturaliste il écrire collaboration roman comme Germinie Lacerteux 1865 roman inspir double vie servante le Lorette Art xviii siècle 1859 1875 il détester philanthropie aimer père Duchesne mémorialiste Chateaubriand,7
448,Edmond_de_Goncourt,Naturalisme,"Edmond Huot de Goncourt né à Nancy le 26 mai 1822 et mort à Champrosay (Seine-et-Oise) le 16 juillet 1896, est un écrivain français.
Il est le fondateur de l'Académie Goncourt qui décerne chaque année le prix homonyme. Une partie de son œuvre est écrite en collaboration avec son frère, Jules de Goncourt. Les ouvrages des frères Goncourt appartiennent au courant du naturalisme.",Edmond Huot Goncourt naître Nancy 26 mai 1822 mort Champrosay 16 juillet 1896 écrivain français il fondateur académie Goncourt décerne chaque année prix homonyme un partie œuvre écrire collaboration frère Jules Goncourt le ouvrage frère Goncourt appartenir courant naturalisme,7
449,Jules_de_Goncourt,Naturalisme,"Jules Huot de Goncourt, né le 17 décembre 1830 à Paris où il est mort le 20 juin 1870, est un écrivain français, à l'origine de l’académie Goncourt qui décerne chaque année le prix du même nom. Une partie de son œuvre fut écrite en collaboration avec son frère, Edmond de Goncourt. Les ouvrages des frères Goncourt appartiennent au courant du naturalisme.",Jules Huot Goncourt naître 17 décembre 1830 Paris où mourir 20 juin 1870 écrivain français origine académie Goncourt décerne chaque année prix nom un partie œuvre écrire collaboration frère Edmond Goncourt le ouvrage frère Goncourt appartenir courant naturalisme,7
450,Gustave_Guiches,Naturalisme,"Alexis Antoine Paul Gustave Guiches est un romancier et dramaturge français, né le 18 juin 1860 à Albas dans le Lot, mort le 3 août 1935 en son domicile dans le 9e arrondissement de Paris.",Alexis Antoine Paul Gustave Guiches romancier dramaturg français naître 18 juin 1860 alba lot mourir 3 août 1935 domicile 9 arrondissement Paris,7
451,Carl_Hauptmann,Naturalisme,"Carl Ferdinand Max Hauptmann, ou de son pseudonyme Ferdinand Klar (né le 11 mai 1858 à Obersalzbrunn en Silésie et mort le 4 février 1921 à Schreiberhau) est un écrivain et dramaturge allemand. Il est le frère aîné de Gerhart Hauptmann.",Carl Ferdinand Max Hauptmann pseudonyme Ferdinand Klar naître 11 mai 1858 Obersalzbrunn Silésie mort 4 février 1921 Schreiberhau écrivain dramaturg allemand il frère aîner Gerhart Hauptmann,7
452,Léon_Hennique,Naturalisme,"Léon Hennique, né à Basse-Terre (Guadeloupe) le 4 novembre 1850 et mort à Paris le 25 décembre 1935, est un romancier naturaliste et auteur dramatique français. Il est enterré à Ribemont.

",Léon Hennique naître Guadeloupe 4 novembre 1850 mort Paris 25 décembre 1935 romancier naturaliste auteur dramatique français il enterrer Ribemont,7
453,Joris-Karl_Huysmans,Naturalisme,"Joris-Karl Huysmans [ɥismɑ̃ːs], nom de plume de Charles Marie Georges Huysmans, est un écrivain et critique d'art français, né le 5 février 1848 à Paris et mort dans la même ville le 12 mai 1907.",Joris Karl Huysmans nom plume Charles Marie Georges Huysmans écrivain critique art français naître 5 février 1848 Paris mort ville 12 mai 1907,7
454,Victor_Joze,Naturalisme,"Joze Dobrski de Jastzebiec, dit Victor Joze, né le 20 avril 1861 à Wyszogród et mort le 18 janvier 1933 à Asnières-sur-Seine, est un écrivain et journaliste français d'origine polonaise.",Joze dobrski Jastzebiec dit Victor Joze naître 20 avril 1861 Wyszogród mort 18 janvier 1933 écrivain journaliste français origine polonais,7
455,Guy_de_Maupassant,Naturalisme,"Henry-René-Albert-Guy de Maupassant  [gi d(ə) mo.pa.ˈsɑ̃] est un écrivain et journaliste littéraire français né le 5 août 1850 au château de Miromesnil à Tourville-sur-Arques, (en Seine-Inférieure) et mort le 6 juillet 1893 à Paris.
Lié à Gustave Flaubert et à Émile Zola, Maupassant a marqué la littérature française par ses six romans, dont Une vie en 1883, Bel-Ami en 1885, Pierre et Jean en 1887-1888, et surtout par ses nouvelles (parfois intitulées contes) comme Boule de Suif en 1880, les Contes de la bécasse (1883) ou Le Horla (1887). Ces œuvres retiennent l’attention par leur force réaliste, la présence importante du fantastique et par le pessimisme qui s’en dégage le plus souvent, mais aussi par la maîtrise stylistique. La carrière littéraire de Maupassant se limite à une décennie — de 1880 à 1890 — avant qu’il ne sombre peu à peu dans la folie et ne meure peu avant l'âge de 43 ans. Reconnu de son vivant, il conserve un renom de premier plan, renouvelé encore par les nombreuses adaptations cinématographiques de ses œuvres.",Henry René Albert Guy Maupassant gi écrivain journaliste littéraire français naître 5 août 1850 château Miromesnil Seine Inférieure mort 6 juillet 1893 Paris lié Gustave Flaubert Émile Zola Maupassant avoir marquer littérature français six roman dont un vie 1883 Bel Ami 1885 Pierre Jean 1887 1888 surtout nouveau parfois intitulée conte comme Boule Suif 1880 conte bécasse 1883 le Horla 1887 ce œuvre retenir attention force réaliste présence important fantastique pessimisme dégage plus souvent aussi maîtrise stylistique le carrière littéraire Maupassant limite décennie 1880 1890 avant sombre peu peu folie mourir peu avant âge 43 an reconnaître vivant conserve renom premier plan renouveler encore nombreux adaptation cinématographique œuvre,7
456,Octave_Mirbeau,Naturalisme,"Octave Mirbeau, né le 16 février 1848 à Trévières (Calvados) et mort le 16 février 1917 à Paris, était un écrivain, critique d'art et journaliste français. Il connut une célébrité européenne et de grands succès populaires, tout en étant également apprécié et reconnu par les avant-gardes littéraires et artistiques.
Journaliste influent et fort bien rémunéré, critique d’art défenseur des avant-gardes, pamphlétaire redouté, Octave Mirbeau était aussi un romancier novateur, qui a contribué à l'évolution du genre romanesque, et un dramaturge, à la fois classique et moderne, qui a triomphé sur toutes les grandes scènes du monde. Mais, après sa mort, il traverse pendant un demi-siècle une période de purgatoire. Il est visiblement trop dérangeant pour la classe dirigeante, tant sur le plan littéraire et esthétique que sur le plan politique et social.
Inclassable sur un plan littéraire, il fait fi des étiquettes, des théories et des écoles, et il étend à tous les genres littéraires sa contestation radicale des institutions culturelles. Il est aussi politiquement incorrect, farouchement individualiste et libertaire. Il incarne ainsi une figure d'intellectuel critique, potentiellement subversif et « irrécupérable » selon l'expression utilisée par Jean-Paul Sartre dans sa pièce de théâtre Les Mains sales (1948).
Guy de Maupassant lui a dédie sa nouvelle Aux champs (1882).",octave Mirbeau naître 16 février 1848 Trévières Calvados mort 16 février 1917 Paris écrivain critique art journaliste français il connaître célébrité européen grand succès populaire tout également apprécier reconnaître littéraire artistique Journaliste influer fort bien rémunérer critique art défenseur pamphlétaire redouter octave Mirbeau aussi romancier novateur avoir contribuer évolution genre romanesque dramaturge fois classique moderne avoir triompher tout grand scène monde mais après mort traverse pendant période purgatoire il visiblement trop dérangeant classe dirigeant tant plan littéraire esthétique plan politique social inclassable plan littéraire faire fi étiquette théorie école étendre tout genre littéraire contestation radical institution culturel il aussi politiquement incorrect farouchement individualiste libertaire il incarne ainsi figure intellectuel critique potentiellement subversif irrécupérable selon expression utiliser Sartre pièce théâtre le main sale 1948 Guy Maupassant avoir dédier nouvelle à champ 1882,7
457,Jean_Richepin,Naturalisme,"Auguste-Jules Richepin, dit Jean Richepin, né à Médéa (Algérie française) le 4 février 1849 et mort à Paris le 12 décembre 1926, est un poète, romancier et auteur dramatique français.",Auguste Jules Richepin dire Jean Richepin naître Médéa algérie français 4 février 1849 mort Paris 12 décembre 1926 poète romancier auteur dramatique français,7
458,Johannes_Schlaf,Naturalisme,"Johannes Schlaf, plus connu sous le pseudonyme de Bjarne P. Holmsen (né à Querfurt le 21 juin 1862, mort le 2 février 1941), est un écrivain, traducteur, et dramaturge allemand, qui a introduit le naturalisme en Allemagne.",Johannes Schlaf plus connaître sous pseudonyme Bjarne Holmsen naître Querfurt 21 juin 1862 mourir 2 février 1941 écrivain traducteur dramaturge allemand avoir introduire naturalisme Allemagne,7
459,Jean_Viollis,Naturalisme,"Jean-Henri d'Ardenne de Tizac dit Jean Viollis est un écrivain naturaliste et sinologue français, né le 17 mai 1877 à Lacapelle-Marival et mort le 17 décembre 1932 à Paris.",Ardenne Tizac dire Jean Viollis écrivain naturaliste sinologue français naître 17 mai 1877 Lacapelle marival mort 17 décembre 1932 Paris,7
460,Ernst_von_Wolzogen,Naturalisme,"Ernst von Wolzogen (né le 23 avril 1855 à Breslau, mort le 30 juillet 1934 à Puppling) est un écrivain allemand.",Ernst von Wolzogen naître 23 avril 1855 Breslau mourir 30 juillet 1934 Puppling écrivain allemand,7
