,Nom,Mouvement,summary,sum_lem,mvm_label
0,William S. Burroughs,Beat Generation,"William Seward Burroughs (/ˈwɪljəm ˈsuɚd ˈbɜɹoʊz/), dit William S. Burroughs, né le 5 février 1914 à Saint-Louis au 4664 de Pershing Avenue, dans l'État du Missouri et mort le 2 août 1997 dans sa propriété de Lawrence (Kansas) de complications liées à une crise cardiaque,, est un romancier et artiste américain.
Principalement connu pour ses romans hallucinés mêlant drogue, homosexualité et anticipation, il est associé à la Beat Generation et à ses figures emblématiques : ses amis Jack Kerouac et Allen Ginsberg. Il a élaboré le cut-up, technique littéraire consistant à créer un texte à partir d'autres fragments textuels d'origines diverses.",William Seward Burroughs ˈsuɚd dit William Burroughs naître 5 février 1914 4664 Pershing Avenue état Missouri mort 2 août 1997 propriété Lawrence Kansas complication lier crise cardiaque romancier artiste américain principalement connaître roman halluciné mêler drogu homosexualité anticipation associer beat generation figure emblématique ami Jack Kerouac Allen Ginsberg il avoir élaborer cut up technique littéraire consister créer texte partir autre fragment textuel origine divers,0
1,Lucien Carr,Beat Generation,"Lucien Carr, né le 1er mars 1925 à New York et mort le 28 janvier 2005 à Washington, 4e du nom, membre de la Beat Generation, est un éditeur américain chez United Press International.",Lucien Carr naître premier mars 1925 New York mort 28 janvier 2005 Washington 4e nom membre Beat Generation éditeur américain chez United Press International,0
2,Carolyn Cassady,Beat Generation,"Carolyn Cassady, née Carolyn Robinson le 28 avril 1923 à Lansing dans le Michigan, et morte le 20 septembre 2013, est une romancière, épistolière américaine.",Carolyn Cassady naître Carolyn Robinson 28 avril 1923 Lansing Michigan mourir 20 septembre 2013 romancier épistolier américain,0
3,John Clellon Holmes,Beat Generation,"John Clellon Holmes est un romancier, essayiste et poète américain, né le 12 mars 1926 à Holyoke au Massachusetts et mort d'un cancer à l'âge de 62 ans le 30 mars 1988, à Middletown dans le Connecticut. Il fut également enseignant à l’université de l’Arkansas et anima à la fin de sa vie des conférences et ateliers à Yale et à l’université Brown.",John Clellon holme romancier essayiste poète américain naître 12 mars 1926 Holyoke Massachusetts mort cancer âge 62 an 30 mars 1988 Middletown Connecticut il également enseigner université Arkansas animer fin vie conférence atelier Yale université Brown,0
4,Gregory Corso,Beat Generation,"Gregory Nunzio Corso (New York, 26 mars 1930 - Minneapolis, 17 janvier 2001) est un poète américain. 
Il fut le quatrième membre majeur de la « Beat Generation », aux côtés de Jack Kerouac, Allen Ginsberg et William Burroughs.",gregory Nunzio Corso New York 26 mars 1930 Minneapolis 17 janvier 2001 poète américain il quatrième membre majeur Beat Generation côté Jack Kerouac Allen Ginsberg William Burroughs,0
5,Lenore Kandel,Beat Generation,"Lenore Kandel, née le 14 janvier 1932 à New York et morte le 18 octobre 2009 à San Francisco, est une poétesse américaine appartenant à la Beat Generation et au collectif des Diggers.",Lenore Kandel naître 14 janvier 1932 New York mourir 18 octobre 2009 San Francisco poétesse américain appartenir beat generation collectif digger,0
6,Jack Kerouac,Beat Generation,"Jean-Louis Kérouac ou Jean-Louis Lebris de Kérouac dit Jack Kerouac /ʒak ke.ʁwak (en anglais : /dʒæk ˈkɛɹuæk/), né le 12 mars 1922 à Lowell dans le Massachusetts et mort le 21 octobre 1969 à St. Petersburg en Floride, est un écrivain et poète américain.
Considéré comme l'un des auteurs américains les plus importants du XXe siècle, il est même pour la communauté beatnik le « King of the Beats ». Son style rythmé et immédiat, auquel il donne le nom de « prose spontanée », a inspiré de nombreux artistes et écrivains et en premier lieu les chanteurs américains Tom Waits et Bob Dylan. Les œuvres les plus connues de Kerouac, Sur la route (considéré comme le manifeste de la Beat Generation), Les Clochards célestes, Big Sur ou Le Vagabond solitaire, narrent de manière romancée ses voyages à travers les États-Unis. Le genre cinématographique du road movie est directement influencé par ses techniques et par son mode de narration.
Jack Kerouac a passé la majeure partie de sa vie partagé entre les grands espaces américains et l'appartement de sa mère. Ce paradoxe est à l'image de son mode de vie : confronté aux changements rapides de son époque, il a éprouvé de profondes difficultés à trouver sa place dans le monde, ce qui l'a amené à rejeter les valeurs traditionnelles des années 1945-1950, donnant ainsi naissance au mouvement beat. Ses écrits reflètent cette volonté de se libérer des conventions sociales étouffantes de son époque et de donner un sens à son existence. Un sens qu'il a cherché dans des drogues comme la marijuana et la benzédrine, dans l'alcool également, dans la religion et la spiritualité — notamment le bouddhisme — et dans une frénésie de voyages.
« Jazz poet », comme il se définit lui-même, Kerouac vante les bienfaits de l'amour, proclame l'inutilité du conflit armé, quel qu'il soit, et considère que « seuls les gens amers dénigrent la vie ». Jack Kerouac et ses écrits sont vus comme précurseurs du mode de vie de la jeunesse des années 1960, celle de la Beat Generation, « qui a ébranlé la société américaine dans ses certitudes. Elle a directement inspiré aussi bien les mouvements de mai 1968 que l’opposition à la guerre du Viêt Nam, ou les hippies de Berkeley et Woodstock. Pourtant la Beat Generation a aussi contribué à enrichir le mythe américain. Sur la route, le roman le plus connu de Kerouac, est une ode aux grands espaces, à l’épopée vers l’ouest, à la découverte de mondes nouveaux ».",Kérouac Lebris Kérouac dire Jack Kerouac anglais naître 12 mars 1922 Lowell Massachusetts mort 21 octobre 1969 Petersburg floride écrivain poète américain considérer comme auteur américain plus important xx siècle communauté beatnik King of the Beats son style rythmer immédiat auquel donne nom pros spontanée avoir inspirer nombreux artiste écrivain premier lieu chanteur américain Tom Waits Bob Dylan le œuvre plus connu Kerouac sur route considérer comme manifeste beat Generation le clochard céleste Big sur le Vagabond solitaire narrent manière romancer voyage travers le genre cinématographique road movi directement influencer technique mode narration Jack Kerouac avoir passer majeur partie vie partager entre grand espace américain appartement mère ce paradoxe image mode vie confronté changement rapide époque avoir éprouver profonde difficulté trouver place monde avoir amener rejeter valeur traditionnel année 1945 1950 donner ainsi naissance mouvement beat son écrit refléter ce volonté libérer convention social étouffant époque donner sens existence un sens avoir chercher drogue comme marijuana benzédrine alcool également religion spiritualité notamment bouddhisme frénésie voyage Jazz poet comme définir Kerouac ver bienfait amour proclame inutilité conflit armer quel considérer seul gens amer dénigrer vie Jack Kerouac écrit voir comme précurseur mode vie jeunesse année 1960 celui Beat Generation avoir ébranler société américain certitude lui avoir directement inspirer aussi bien mouvement mai 1968 opposition guerre Viêt Nam hippie Berkeley Woodstock pourtant beat generation avoir aussi contribuer enrichir mythe américain sur route roman plus connaître Kerouac ode grand espace épopée vers ouest découverte monde nouveau,0
7,Jan Kerouac,Beat Generation,"Janet Michelle Kerouac, plus connue en tant que Jan Kerouac, née le 16 février 1952 à Albany et morte le 5 juin 1996 à Albuquerque, est une écrivaine américaine.
Elle est la seule enfant de Jack Kerouac, figure de la Beat Generation.",Janet Michelle Kerouac plus connaître tant Jan Kerouac naître 16 février 1952 Albany mourir 5 juin 1996 Albuquerque écrivaine américaine lui seul enfant Jack Kerouac figure Beat Generation,0
8,Gerald Nicosia,Beat Generation,"Gerald Nicosia, né le 18 novembre 1949 à Berwyn dans l'Illinois, est un journaliste indépendant, interviewer et critique littéraire américain.",Gerald Nicosia naître 18 novembre 1949 Berwyn Illinois journaliste indépendant interviewer critique littéraire américain,0
9,Peter Orlovsky,Beat Generation,"Peter Orlovsky, né le 8 juillet 1933 à New York dans le Lower East Side, et mort le 30 mai 2010 à Williston dans le Vermont, est un poète américain, amant d'Allen Ginsberg et membre de la Beat Generation.",peter Orlovsky naître 8 juillet 1933 New York Lower East Side mourir 30 mai 2010 Williston Vermont poète américain amer Allen Ginsberg membre Beat Generation,0
10,John Wieners,Beat Generation,"John Joseph Wieners, né à Boston dans le Massachusetts le 6 janvier 1934, mort à Boston le 1er mars 2002, est un poète et un universitaire américain qui fut une figure majeure de la Beat Generation, de la San Francisco Renaissance, de la New School de New York, un pacifiste et un activiste de la cause des gays.",John Joseph Wieners naître Boston Massachusetts 6 janvier 1934 mort Boston premier mars 2002 poète universitaire américain figure majeur Beat Generation San Francisco Renaissance New School New York pacifiste activiste cause gay,0
11,Sherwood Anderson,Génération perdue,"Sherwood Anderson, né le 13 septembre 1876 à Camden (Ohio) et décédé le 8 mars 1941 à Panama, est un romancier américain surtout connu pour ses nouvelles, notamment le recueil Winesburg-en-Ohio, qui met en scène de petites gens, des personnages parfois frustrés de leur vie et dont l'action se situe dans l'Ohio.
Il a influencé quelques grandes figures de la fiction américaine, notamment Ernest Hemingway, William Faulkner, Thomas Wolfe, John Steinbeck ou Erskine Caldwell,.

",Sherwood Anderson naître 13 septembre 1876 Camden Ohio décéder 8 mars 1941 Panama romancier américain surtout connaître nouveau notamment recueil mettre scène petit gens personnage parfois frustrer vie dont action situe Ohio il avoir influencer quelque grand figure fiction américain notamment Ernest Hemingway William Faulkner Thomas Wolfe John Steinbeck Erskine Caldwell,4
12,Sylvia Beach,Génération perdue,"Sylvia Beach, née Nancy Woodbridge Beach le 14 mars 1887 à Baltimore, Maryland et décédée le 3 octobre 1962 à Paris 6e, est une libraire, traductrice et éditrice américaine.
Elle est connue pour sa célèbre librairie parisienne Shakespeare and Company où elle publia, en 1922, la première édition d'Ulysses de James Joyce.",Sylvia Beach naître Nancy Woodbridge Beach 14 mars 1887 Baltimore Maryland décéder 3 octobre 1962 Paris 6e libraire traductrice éditeur américain lui connaître célèbre librairie parisien Shakespeare and Company où publia 1922 premier édition ulysse James Joyce,4
13,E. E. Cummings,Génération perdue,"Edward Estlin Cummings, plus connu sous le diminutif de e. e. cummings (né le 14 octobre 1894 à Cambridge, Massachusetts et mort le 3 septembre 1962), est un poète, écrivain et peintre américain.
Son œuvre est composée de plus de deux mille neuf cents poèmes, de quelques pièces, d'essais, et de deux nouvelles ainsi que de nombreux dessins, esquisses et peintures. Il est l'un des grands poètes du XXe siècle et l'un des plus populaires.",Edward Estlin Cummings plus connaître sous diminutif cumming naître 14 octobre 1894 Cambridge Massachusetts mort 3 septembre 1962 poète écrivain peintr américain son œuvre composer plus deux mille neuf cent poème quelque pièce essai deux nouveau ainsi nombreux dessin esquisse peinture il grand poète xx siècle plus populaire,4
14,John Dos Passos,Génération perdue,"John Roderigo Dos Passos, né le 14 janvier 1896 à Chicago et mort le 28 septembre 1970 à Baltimore, est un écrivain et un peintre américain. Dos Passos est connu pour son œuvre littéraire dans laquelle il commente les événements turbulents du XXe siècle, lui donnant la réputation d'un critique acharné de la politique et du mode de vie américain.
Proche des libertaires pendant  l'affaire Sacco et Vanzetti,, il développe des sympathies communistes dans les années 1920 et 1930, mais change de cap après qu'un de ses meilleurs amis, José Robles, eut été exécuté par les staliniens pendant les journées de mai 1937 à Barcelone lors de la guerre civile espagnole.
Familier des techniques du réalisme et du courant de conscience, John Dos Passos les utilise pour asseoir une analyse sociale pessimiste. Il y décrit la vie de quelques personnages représentant différentes classes sociales, leurs espoirs et leurs désillusions. En cela il se rapproche d'un certain réalisme socialiste qu'il ne renie pas, puisqu'il avoue une admiration sans faille pour Eisenstein. De là vint d'ailleurs ce terme de « littérature cinématographique » utilisé par de nombreux critiques à propos de ses livres.
Au cours d'une longue carrière faite de succès, Dos Passos écrit quarante-deux romans, des poèmes, des essais, des pièces de théâtre et crée plus de quatre cents œuvres d'art. On retiendra surtout de lui Manhattan Transfer et sa trilogie  U.S.A., écrits dans les années 1920 et 1930, période où il est à l'acmé de sa gloire littéraire.",John Roderigo Dos Passos naître 14 janvier 1896 Chicago mort 28 septembre 1970 Baltimore écrivain peintre américain dos Passos connaître œuvre littéraire lequel commente événement turbulent xx siècle donner réputation critique acharner politique mode vie américain proche libertaire pendant affaire Sacco Vanzetti développe sympathie communiste année 1920 1930 change cap après meilleur ami josé Robles exécuter stalinien pendant journée mai 1937 Barcelone lors guerre civil espagnol Familier technique réalisme courant conscience John Dos Passos utilise asseoir analyse social pessimiste il décrire vie quelque personnage représentant différents classe social leur espoir leur désillusion en cela rapproche certain réalisme socialiste renier avoue admiration sans faille Eisenstein de là vint ailleurs terme littérature cinématographique utiliser nombreux critique propos livre au cours long carrière faire succès Dos Passos écrire quarante deux roman poème essai pièce théâtre créer plus quatre cent œuvre art on retenir surtout Manhattan Transfer trilogie écrire année 1920 1930 période où acmé gloire littéraire,4
15,T. S. Eliot,Génération perdue,"T. S. Eliot, de son nom complet Thomas Stearns Eliot (26 septembre 1888 - 4 janvier 1965), est un poète, dramaturge et critique littéraire américain naturalisé britannique. Il a reçu le prix Nobel de littérature en 1948.
Il est d'abord proche de la modernité poétique américaine et du groupe formé autour d'Ezra Pound, qui publie dans sa revue le poème d'Eliot La Chanson d'amour de J. Alfred Prufrock (1917), et à qui est dédié La Terre vaine (1922). Après sa conversion à l'anglicanisme et sa naturalisation britannique, il se tourne vers une écriture centrée sur la spiritualité, représentée notamment par Quatre Quatuors (1939-1942), qui lui vaudront le prix Nobel de littérature en 1948. Il écrit également sept pièces de théâtre et un grand nombre d'essais sur la poésie et sur des auteurs comme William Shakespeare et Ezra Pound.",Eliot nom complet Thomas Stearns Eliot 26 septembre 1888 4 janvier 1965 poète dramaturge critique littéraire américain naturaliser britannique il avoir recevoir prix Nobel littérature 1948 il abord proche modernité poétique américaine groupe formé autour Ezra Pound publier revue poème Eliot le chanson amour Alfred Prufrock 1917 dédier le terre vain 1922 après conversion anglicanisme naturalisation britannique tourne vers écriture centrer spiritualité représenter notamment quatre quatuors 1939 1942 valoir prix Nobel littérature 1948 il écrire également sept pièce théâtre grand nombre essai poésie auteur comme William Shakespeare Ezra Pound,4
16,F. Scott Fitzgerald,Génération perdue,"Francis Scott Key Fitzgerald, né le 24 septembre 1896 à Saint Paul, Minnesota et mort le 21 décembre 1940 à Hollywood, est un écrivain américain.
Chef de file de la Génération perdue et représentant de l'Ère du Jazz, il est aussi celui qui lance la carrière d'Ernest Hemingway. Son roman le plus célèbre reste Gatsby le Magnifique, succès planétaire qui fut adapté de nombreuses fois au cinéma, à la télévision ou sur scène. 
Il se marie en 1920 avec Zelda Sayre, une jeune fille du Sud qui sera son égérie (et l'auteur d'un roman autobiographique : Accordez-moi cette valse, publié en 1932). Ils ont une fille, Frances Scott Fitzgerald, qu'ils surnomment « Scottie ».

",Francis Scott Key fitzgerald naître 24 septembre 1896 Saint Paul Minnesota mort 21 décembre 1940 Hollywood écrivain américain chef file génération perdre représentant Ère Jazz aussi celui lancer carrière Ernest Hemingway son roman plus célèbre reste gatsby magnifique succès planétaire adapter nombreux fois cinéma télévision scène il marier 1920 Zelda Sayre jeune fille Sud égérie auteur roman autobiographique Accordez ce valse publier 1932 il fille france Scott fitzgerald surnommer Scottie,4
17,Ernest Hemingway,Génération perdue,"Ernest Hemingway [ˈɝnɪst ˈhɛmɪŋˌweɪ], né le 21 juillet 1899 à Oak Park dans l'Illinois aux États-Unis et mort le 2 juillet 1961 à Ketchum (Idaho), est un écrivain, journaliste et correspondant de guerre américain.
Son style d'écriture, caractérisé par l'économie et la litote, a influencé le roman du XXe siècle, comme l'ont fait sa vie d'aventurier et l'image publique qu'il entretenait. Il a écrit la plupart de ses œuvres entre le milieu des années 1920 et le milieu des années 1950, et sa carrière a culminé en 1954 lorsqu'il a reçu le prix Nobel de littérature. Ses romans ont rencontré un grand succès auprès du public du fait de la véracité avec laquelle il dépeignait ses personnages. Plusieurs de ses œuvres furent élevées au rang de classiques de la littérature américaine. Il a publié de son vivant sept romans, six recueils de nouvelles et deux œuvres non romanesques. Trois romans, quatre recueils de nouvelles et trois œuvres non romanesques ont été publiés à titre posthume.
Hemingway est né et a grandi à Oak Park, une ville située en banlieue ouest de Chicago dans l'Illinois. Après avoir quitté le lycée, il a travaillé pendant quelques mois en tant que journaliste reporter au Kansas City Star, avant de partir pour le front italien et devenir ambulancier pendant la Première Guerre mondiale, ce qui a servi de fondement à son roman L'Adieu aux armes. Il fut grièvement blessé et passa alors plus de trois mois à l'hôpital. À sa sortie, il s'engagea dans l'armée italienne. 
En 1922, Hemingway épousa Hadley Richardson, la première de ses quatre épouses, et le couple s'installa à Paris où il travailla comme correspondant étranger. Au cours de cette période, il rencontra des écrivains, dont Gertrude Stein, Ezra Pound et James Joyce en fréquentant la librairie Shakespeare and Company, et des artistes modernistes des années 1920 de la communauté expatriée connus sous le nom de Génération perdue, dont certains exercèrent sur lui une influence significative. Son premier roman, Le Soleil se lève aussi, a été écrit en 1926.
Après avoir divorcé d'Hadley Richardson en 1927, Hemingway épousa Pauline Pfeiffer mais ils divorcèrent après le retour d'Hemingway d'Espagne où il avait couvert la guerre civile espagnole, qui lui permit d'écrire Pour qui sonne le glas.
Martha Gellhorn devint sa troisième épouse en 1940. Mais, soucieuse de son 'indépendance', elle le quitte, quand, après qu'il eut accepté de l'accompagner en Chine pour suivre la guerre sino-japonaise, il refusa de faire de même pour l'invasion de la France. (Elle fut la seule journaliste 'femme' à poser le pied sur les plages normandes, le 6 juin 1944). 
Après cette séparation, pour lui douloureuse, Hemingway épouse en 1945 Mary Welsh. Cette union s'établit peu après la Seconde Guerre mondiale période pendant laquelle il fut présent, à distance (sans être autorisé, contrairement à Martha, son épouse d'alors), le jour du débarquement en Normandie. Puis, il put participer, plus directement, à la libération de Paris.
En 1948, Hemingway et son épouse décident de se rendre sur la Côte d'Azur mais doivent faire une escale à Gênes en raison d'une panne de leur bateau. Ils en profitent pour se rendre à Venise qu'ils ne connaissent pas et descendent à l'hôtel Gritti, fréquentent le Harry's Bar. Invité à une chasse au canard, Hemingway fait la connaissance de la comtesse Adriana Ivancich dont il tombe amoureux, et qui le rejoindra d'ailleurs à Cuba. Après quelques mois, elle repartira. Ils se reverront en Italie en 1954. Alors qu'il est fatigué, malade et dépressif, cette aventure lui redonne l'inspiration perdue, et il écrit ""Au-delà du fleuve et sous les arbres"", comme un reflet de leur idylle, en y mêlant ses propres souvenirs de Première Guerre mondiale, bien qu'il ait démenti toute ressemblance avec la réalité dans l'avertissement de la préface. Alors qu'il pense avoir écrit une œuvre remarquable, la critique américaine est féroce.
Peu de temps après la publication du Vieil homme et la mer, en 1952, qui lui valut le prix Pulitzer en 1953, Hemingway participa à un safari en Afrique, où il faillit être tué dans un accident d'avion qui le laissa perclus de douleurs et en mauvaise santé pour le reste de sa vie.
Hemingway a habité à Key West, en Floride et à La Havane pendant les années 1930 et 1940. En 1959, il quitte Cuba pour Ketchum, dans l'Idaho, où il se suicide au cours de l'été 1961.",Ernest Hemingway ˈɝnɪst ˈhɛmɪŋˌweɪ naître 21 juillet 1899 Oak Park Illinois mort 2 juillet 1961 Ketchum Idaho écrivain journaliste correspondre guerre américain son style écriture caractériser économie litote avoir influencer roman xx siècle comme faire vie aventurier image public entretenir il avoir écrire plupart œuvre entre milieu année 1920 milieu année 1950 carrière avoir culminer 1954 avoir recevoir prix Nobel littérature son roman rencontrer grand succès auprès public fait véracité lequel dépeindre personnage plusieurs œuvre élever rang classique littérature américain il avoir publier vivant sept roman six recueil nouveau deux œuvre non romanesque Trois roman quatre recueil nouveau trois œuvre non romanesque publier titre posthume hemingway naître avoir grandi Oak Park ville situer banlieue ouest Chicago Illinois après avoir quitter lycée avoir travailler pendant quelque mois tant journaliste reporter Kansas City Star avant partir front italien devenir ambulancier pendant premier guerre mondial avoir servir fondement roman Adieu arme il grièvement blesser passer alors plus trois mois hôpital à sortie engager armée italien en 1922 Hemingway épouser Hadley Richardson première quatre épouse couple installer Paris où travailler comme correspondre étranger au cours ce période rencontrer écrivain dont Gertrude Stein Ezra Pound James Joyce fréquenter librairie Shakespeare and Company artiste moderniste année 1920 communauté expatrier connaître sous nom génération perdre dont certains exercer influence significatif son premier roman le soleil lever aussi avoir écrire 1926 après avoir divorcé Hadley Richardson 1927 Hemingway épouser Pauline Pfeiffer divorcer après retour Hemingway Espagne où couvrir guerre civil espagnol permettre écrir pour sonne glas Martha Gellhorn devenir troisième épouse 1940 mais soucieuse indépendance quitte quand après accepter accompagner Chine suivre guerre refuser faire invasion France lui seul journaliste femme poser pied plage normande 6 juin 1944 après ce séparation douloureux Hemingway épous 1945 mary Welsh ce union établir peu après second guerre mondial période pendant lequel présent distance sans être autoriser contrairement Martha épouse alors jour débarquement Normandie puis put participer plus directement libération Paris en 1948 Hemingway épouse décident rendre Côte Azur devoir faire escale Gênes raison panne bateau il profitent rendre venise connaître descendent hôtel Gritti fréquentent Bar invité chasse canard Hemingway faire connaissance comtesse Adriana Ivancich dont tombe amoureux rejoindra ailleurs Cuba après quelque mois repartir il revoir Italie 1954 alors fatiguer malade dépressif ce aventure redonne inspiration perdre écrire au delà fleuve sous arbre comme reflet idylle mêler propre souvenir premier guerre mondial bien démentir tout ressemblance réalité avertissement préface alors pense avoir écrire œuvre remarquable critique américain féroce peu temps après publication vieux homme mer 1952 valoir prix pulitzer 1953 Hemingway participer safari Afrique où faillir être tuer accident avion laissa perclus douleur mauvais santé reste vie hemingway avoir habiter Key West floride le Havane pendant année 1930 1940 en 1959 quitte Cuba Ketchum idaho où suicide cours 1961,4
