,Nom,Mouvement,summary,sum_lem,mvm_label
160,Willem Jacobszoon Hofdijk,romantique,"Willem Jacobszoon Hofdijk (souvent abrégé en W.J. Hofdijk) est un écrivain et historien romantique néerlandais, né le 27 juin 1816 à Alkmaar et mort le 29 août 1888 à Arnhem. Son genre de prédilection est le roman historique, dont Ons Voorgeslacht reste son œuvre la plus marquante.",Willem Jacobszoon Hofdijk souvent abréger Hofdijk écrivain historien romantique néerlandais naître 27 juin 1816 alkmaar mort 29 août 1888 Arnhem son genre prédilection roman historique dont Ons Voorgeslacht reste œuvre plus marquant,34
161,Ernst Theodor Amadeus Hoffmann,romantique,"Ernst Theodor Amadeus Hoffmann [ɛʁnst ˈteːodoːɐ̯ amaˈdeːʊs ˈhɔfˌman], né Ernst Theodor Wilhelm Hoffmann le 24 janvier 1776 à Königsberg, en province de Prusse-Orientale, et mort le 25 juin 1822 à Berlin (à l'âge de 46 ans), est un écrivain romantique et un compositeur, également dessinateur et juriste prussien.
Juriste de formation, Hoffmann sert dans l'administration prussienne de 1796 à 1806, puis de 1814 à sa mort. Également dessinateur et peintre, son indépendance d'esprit et son goût de la satire lui valent à plusieurs reprises de sérieux ennuis auprès de ses supérieurs hiérarchiques, qu'il n'hésite pas à caricaturer.
C'est surtout en raison de son activité littéraire que Hoffmann est célèbre. Connu sous le nom d'« E. T. A. Hoffmann », il est l'auteur de nombreux contes (Märchen en allemand) comme : L'Homme au sable, Les Mines de Falun ou Casse-Noisette et le Roi des souris et de plusieurs romans, dont son œuvre principale Le Chat Murr. Il devient alors, dès les années 1820, l'une des illustres figures du romantisme allemand et il inspire de nombreux artistes, en Europe comme dans le reste du monde. Par exemple, Jacques Offenbach écrit l'opéra fantastique en cinq actes Les Contes d'Hoffmann en s'inspirant de l'univers du romantique allemand.
Également passionné de musique, il abandonne son troisième prénom, « Wilhelm », pour celui d'« Amadeus » en hommage à Mozart, son modèle, et devient critique musical, puis compositeur. Il est ainsi l'auteur de plusieurs opéras, en particulier Ondine, qui est tiré d'un conte de son ami Friedrich de La Motte-Fouqué, ainsi que d'œuvres vocales et instrumentales.",Ernst Theodor Amadeus Hoffmann ɛʁnst amaˈdeːʊ ˈhɔfˌman naître Ernst Theodor Wilhelm Hoffmann 24 janvier 1776 Königsberg province Prusse Orientale mourir 25 juin 1822 Berlin âge 46 an écrivain romantique compositeur également dessinateur juriste prussien juriste formation Hoffmann servir administration prussien 1796 1806 puis 1814 mort également dessinateur peintr indépendance esprit goût satire valoir plusieurs reprise sérieux ennui auprès supérieur hiérarchique hésite caricaturer surtout raison activité littéraire Hoffmann célèbre connaître sous nom Hoffmann auteur nombreux conte märchen allemand comme homme sable le Mines Falun roi souris plusieurs roman dont œuvre principal le chat murr il devenir alors dès année 1820 illustre figure romantisme allemand inspire nombreux artiste Europe comme reste monde par exemple Jacques Offenbach écrire opéra fantastique cinq acte le conte Hoffmann inspirer univers romantique allemand également passionner musique abandonne troisième prénom Wilhelm celui Amadeus hommage Mozart modèle devenir critique musical puis compositeur il ainsi auteur plusieurs opéra particulier ondin tirer conte ami Friedrich le Motte Fouqué ainsi œuvre vocal instrumental,34
162,Victor Hugo,romantique,"Victor Hugo est un poète, dramaturge, écrivain, romancier et dessinateur romantique français, né le 26 février 1802 (7 ventôse an X) à Besançon et mort le 22 mai 1885 à Paris. Il est considéré comme l'un des plus importants écrivains de la langue française. Il est aussi une personnalité politique et un intellectuel engagé qui a eu un rôle idéologique majeur et occupe une place marquante dans l'histoire des lettres françaises au XIXe siècle.
Au théâtre, Victor Hugo s'est imposé comme un des chefs de file du romantisme français en présentant sa conception du drame romantique dans les préfaces qui introduisent Cromwell en 1827, puis Hernani en 1830, qui sont de véritables manifestes, puis par ses autres œuvres dramatiques, en particulier Lucrèce Borgia en 1833 et Ruy Blas en 1838.
Son œuvre poétique comprend plusieurs recueils de poèmes lyriques, dont les plus célèbres sont Odes et Ballades paru en 1826, Les Feuilles d'automne en 1831 et Les Contemplations en 1856. Victor Hugo est aussi un poète engagé contre Napoléon III dans Les Châtiments, paru en 1853, et un poète épique dans La Légende des siècles, publié de 1859 à 1883.
Comme romancier, il a rencontré un grand succès populaire, d'abord avec Notre-Dame de Paris en 1831, et plus encore avec Les Misérables en 1862.
Son œuvre multiple comprend aussi des écrits et discours politiques, des récits de voyages, des recueils de notes et de mémoires, des commentaires littéraires, une correspondance abondante, près de quatre mille dessins dont la plupart réalisés à l'encre, ainsi que la conception de décors intérieurs et une contribution à la photographie.
Très impliqué dans le débat public, Victor Hugo a été parlementaire sous la monarchie de Juillet et sous la Deuxième et Troisième République. Il s'est exilé pendant près de vingt ans à Jersey et Guernesey sous le Second Empire, dont il a été l'un des grands opposants. Attaché à la paix et à la liberté et sensible à la misère humaine, il s'est exprimé en faveur de nombreuses avancées sociales, s'est opposé à la peine de mort et a soutenu l'idée d'une Europe unifiée.
Son engagement résolument républicain dans la deuxième partie de sa vie et son immense œuvre littéraire ont fait de lui un personnage emblématique, que la Troisième République a honoré par des funérailles nationales et le transfert de sa dépouille au Panthéon de Paris le 1er juin 1885, dix jours après sa mort.
Ayant fortement contribué au renouvellement de la poésie et du théâtre et ayant marqué son époque par ses prises de position politiques et sociales, Victor Hugo est encore célébré aujourd'hui, en France et à l'étranger, comme un personnage illustre, dont la vie et l'œuvre ont fait l'objet de multiples commentaires et hommages.",Victor Hugo poète dramaturge écrivain romancier dessinateur romantique français naître 26 février 1802 7 ventôse an x Besançon mort 22 mai 1885 Paris il considérer comme plus important écrivain langue français il aussi personnalité politique intellectuel engager avoir rôle idéologique majeur occupe place marquant histoire lettre français xix siècle au théâtre Victor Hugo imposer comme chef file romantisme français présenter conception drame romantique préface introduire Cromwell 1827 puis Hernani 1830 véritable manifeste puis autre œuvre dramatique particulier Lucrèce Borgia 1833 Ruy Blas 1838 son œuvre poétique comprendre plusieurs recueil poème lyrique dont plus célèbre Odes Ballades paraître 1826 le feuille automne 1831 le contemplation 1856 victor Hugo aussi poète engager contre Napoléon iii le châtiment paraître 1853 poète épique le Légende siècle publier 1859 1883 comme romancier avoir rencontrer grand succès populaire abord Paris 1831 plus encore le misérable 1862 son œuvre multiple comprendre aussi écrit discours politique récit voyage recueil note mémoire commentaire littéraire correspondance abondant près quatre mille dessin dont plupart réaliser encre ainsi conception décors intérieur contribution photographie très impliquer débat public Victor Hugo avoir parlementaire sous monarchie juillet sous deuxième troisième république il exiler pendant près vingt an Jersey guernesey sous Second Empire dont avoir grand opposant attaché paix liberté sensible misère humain exprimer faveur nombreux avancée social opposer peine mort avoir soutenir idée Europe unifier son engagement résolumer républicain deuxième partie vie immense œuvr littéraire faire personnage emblématique troisième république avoir honorer funéraille national transfert dépouille panthéon Paris premier juin 1885 dix jour après mort avoir fortement contribuer renouvellement poésie théâtre marquer époque prise position politique social Victor Hugo encore célébré France étranger comme personnage illustre dont vie œuvre faire objet multiple commentaire hommage,34
163,John Keats,romantique,"John Keats /dʒɒn ˈkiːts/, né le 31 octobre 1795 à Londres et mort le 23 février 1821 à Rome, est un poète britannique considéré comme un romantique de la deuxième génération, celle de Lord Byron et de Percy Bysshe Shelley. Il commence à être publié en 1817, soit quatre années avant sa mort de la phtisie, à vingt-cinq ans.
La poésie de John Keats se réclame de nombreux genres, du sonnet et de la romance spensérienne jusqu'à l'épopée inspirée par John Milton et qu'il remodèle selon ses exigences. Ses œuvres les plus admirées sont les six odes datées de 1819, l'Ode sur l'indolence, l'Ode sur la mélancolie, l'Ode à Psyché, l'Ode sur une urne grecque, l'Ode à un rossignol et l'Ode à l'automne, souvent considérée comme le poème le plus abouti jamais écrit en anglais.
De son vivant, Keats n'est point associé aux principaux poètes de la mouvance romantique, et lui-même se sent mal à l'aise en leur compagnie. En dehors du cercle d'intellectuels libéraux gravitant autour de son ami, l'écrivain Leigh Hunt, son œuvre se voit critiquée par les commentateurs conservateurs comme étant mièvre et de mauvais goût, de la « poésie de parvenu » selon John Gibson Lockhart, et d'après John Wilson Croker « mal écrite et vulgaire ».
En revanche, à partir de la fin de son siècle, la gloire de Keats ne cesse de croître : il est alors compté parmi les plus grands poètes de langue anglaise et ses œuvres en vers, tout comme sa correspondance — essentiellement avec son frère cadet George et quelques amis —, figurent parmi les textes les plus commentés de la littérature anglaise.
Le lecteur est sensible à la richesse mélancolique de son imagerie très sensuelle, en particulier dans la série des odes, que sous-tend un imaginaire paroxystique privilégiant l'émotion souvent transmise à travers la comparaison ou la métaphore. De plus, son langage poétique, choix des mots et agencement prosodique, se caractérise par une lenteur et une plénitude éloignées des usages instaurés en 1798 par la publication du recueil de poèmes de William Wordsworth et Samuel Taylor Coleridge, les Ballades lyriques.",John Keats naître 31 octobre 1795 Londres mort 23 février 1821 Rome poète britannique considérer comme romantique deuxième génération celui Lord Byron Percy Bysshe Shelley il commencer être publier 1817 quatre année avant mort phtisie an le poésie John Keats réclame nombreux genre sonnet romance spensérienne épopée inspirer John Milton remodeler selon exigence son œuvre plus admirer six ode dater 1819 Ode indolence Ode mélancolie Ode Psyché Ode urne grec Ode rossignol Ode automne souvent considérer comme poème plus abouti jamais écrire anglais de vivant Keats poindre associer principal poète mouvance romantique sentir mal aise compagnie en dehors cercle intellectuel libéral graviter autour ami écrivain Leigh Hunt œuvre voir critiquer commentateur conservateur comme mièvre mauvais goût poésie parvenir selon John Gibson Lockhart après John Wilson Croker mal écrite vulgaire en revanche partir fin siècle gloire Keats cesse croître alors compter parmi plus grand poète langue anglaise œuvre vers tout comme correspondance essentiellement frère cadet George quelque ami figurent parmi texte plus commenté littérature anglais le lecteur sensible richesse mélancolique imagerie très sensuel particulier série ode imaginaire paroxystique privilégier émotion souvent transmettre travers comparaison métaphore de plus langage poétique choix mot agencement prosodique caractérise lenteur plénitude éloigner usage instaurer 1798 publication recueil poème William Wordsworth Samuel Taylor Coleridge ballade lyrique,34
164,Heinrich von Kleist,romantique,"Heinrich von Kleist [ˈhaɪ̯nʁɪç fɔn ˈklaɪ̯st], de son nom complet Bernd Heinrich Wilhelm von Kleist (Francfort-sur-l'Oder le 18 octobre 1777 – Berlin, Wannsee, le 21 novembre 1811), est un écrivain prussien, poète, dramaturge et essayiste.",Heinrich von Kleist fɔn nom complet Bernd Heinrich Wilhelm von Kleist 18 octobre 1777 Berlin Wannsee 21 novembre 1811 écrivain prussien poète dramaturge essayiste,34
165,Alphonse de Lamartine,romantique,"Alphonse de Lamartine, de son nom complet Alphonse Marie Louis de Prat de Lamartine, né le 21 octobre 1790 à Mâcon et mort le 28 février 1869 à Paris, est un poète, romancier, dramaturge français, historien, ainsi qu'une personnalité politique qui participa à la révolution de 1848 et proclama la Deuxième République. Il est l'une des grandes figures du romantisme en France.
Il passe son enfance en Bourgogne du sud, en particulier à Milly, qui nourrira son inspiration poétique, et se forme au collège à Lyon puis à Belley avant de revenir dans le Mâconnais où il mène une vie de jeune homme oisif et séducteur. Il voyage en Italie et occupe une éphémère fonction militaire auprès de Louis XVIII. En octobre 1816, en cure à Aix-les-Bains, la rencontre avec une jeune femme mariée, Julie Charles, marque un tournant décisif dans la vie du poète mais leur histoire d'amour passionnée vire à la tragédie lorsque Julie, restée à Paris, meurt en décembre 1817. Alphonse de Lamartine écrit alors les poèmes des Méditations dont le recueil est publié en 1820 et obtient un succès fulgurant. Il épouse la même année Mary Ann Elisa Birch, une jeune Anglaise, et occupe des fonctions de secrétaire d'ambassade en Italie avant de démissionner en 1830. Il publie durant cette période d'autres œuvres poétiques comme, en 1823, les Nouvelles Méditations poétiques et La Mort de Socrate, ou encore, en juin 1830, les Harmonies poétiques et religieuses après avoir été élu à l’Académie française en 1829.
En 1830, il décide d'entrer en politique en se ralliant à la monarchie de Juillet mais échoue à la députation. Il effectue alors un voyage en Orient, où il visite la Grèce, le Liban et les lieux saints du christianisme, relaté dans Voyage en Orient et marqué par le drame de la mort de sa fille Julia. En 1833, Lamartine est élu député.Il joue un rôle important au moment de la Révolution de 1848, proclamant la République, et assure pendant trois mois un poste, celui de député siégeant à la commission exécutive au gouvernement provisoire. Il se retire de la vie politique après sa lourde défaite à l’élection présidentielle de 1848, alors que Louis-Napoléon Bonaparte l’emporte.
Lourdement endetté, il vend le domaine de Milly en 1860 et écrit des œuvres alimentaires comme de nombreuses compilations historiques, son Cours familier de littérature (1856-1869), et d'autres œuvres moins décriées mais demeurant mineures telles que Le Tailleur de pierre de Saint-Point en 1851. Son dernier grand poème La Vigne et la Maison est écrit en 1857.
Alphonse de Lamartine meurt en 1869, à 78 ans, et repose dans le caveau familial au cimetière communal, le long du mur du parc du château de Saint-Point qu'il a habité et transformé depuis 1820.
Son lyrisme associé à une expression harmonieuse fait la qualité des poèmes de Lamartine, la partie la plus marquante de son œuvre étant constituée par les poèmes pleins de sensibilité inspirés par Julie Charles, empreints des thèmes romantiques de la nature, de la mort, et de l'amour (par exemple dans Le Lac, L'Isolement, L'Automne, etc.). Admiré et salué par toute la génération romantique (Victor Hugo, Nodier, Sainte-Beuve), Lamartine est parfois jugé plus sévèrement par les générations suivantes : Flaubert parle de « lyrisme poitrinaire » et Rimbaud écrit dans sa Lettre du voyant à Paul Demeny que « Lamartine est quelquefois voyant, mais étranglé par la forme vieille ». Il reste cependant largement admiré pour la puissance de son génie poétique et compte indiscutablement parmi les plus grands poètes français du XIXe siècle.

",alphonse Lamartine nom complet alphonse Marie Louis prat Lamartine naître 21 octobre 1790 mâcon mort 28 février 1869 Paris poète romancier dramaturge français historien ainsi personnalité politique participer révolution 1848 proclamer deuxième république il grand figure romantisme France il passer enfance Bourgogne sud particulier Milly nourrir inspiration poétique forme collège Lyon puis Belley avant revenir mâconnais où mener vie jeune homme oisif séducteur il voyage Italie occupe éphémère fonction militaire auprès Louis XVIII en octobre 1816 cure rencontre jeune femme marier Julie Charles marque tournant décisif vie poète histoire amour passionner vire tragédie lorsque Julie rester Paris meurt décembre 1817 alphonse Lamartine écrire alors poème méditation dont recueil publier 1820 obtenir succès fulgurant il épouse année mary Ann Elisa Birch jeune Anglaise occupe fonction secrétaire ambassade Italie avant démissionner 1830 il publier durant ce période autre œuvre poétique comme 1823 nouveau méditation poétique le mort Socrate encore juin 1830 harmonie poétique religieux après avoir élire académie français 1829 en 1830 décide entrer politique rallier monarchie juillet échoue députation il effectue alors voyage Orient où visite Grèce Liban lieu saint christianisme relater voyage Orient marquer drame mort fille julia en 1833 Lamartine élire députer il joue rôle important moment révolution 1848 proclamer république assure pendant trois mois poste celui député siéger commission exécutif gouvernement provisoire il retire vie politique après lourde défaire élection présidentiel 1848 alors Bonaparte emporter Lourdement endetter vendre domaine Milly 1860 écrire œuvre alimentaire comme nombreux compilation historiquer cours familier littérature 1856 1869 autre œuvre moins décrier demeurer mineur tel le tailleur pierre 1851 son dernier grand poème le Vigne maison écrire 1857 alphonse Lamartine meurt 1869 78 an repose caveau familial cimetière communal long mur parc château avoir habiter transformer depuis 1820 son lyrisme associer expression harmonieux faire qualité poème Lamartine partie plus marquant œuvre constituer poème plein sensibilité inspirer Julie Charles empreint thème romantique nature mort amour exemple le Lac Isolement Automne Admiré saluer tout génération romantique Victor Hugo Nodier Lamartine parfois juger plus sévèrement génération suivant flaubert parle lyrisme poitrinaire Rimbaud écrire lettre voyant Paul Demeny lamartin quelquefois voyant étrangler forme vieux il reste cependant largement admirer puissance génie poétique compte indiscutablemer parmi plus grand poète français xix siècle,34
166,Friedrich de La Motte-Fouqué,romantique,"Friedrich Heinrich Karl de la Motte, Baron Fouqué, dit Pellegrin et A.L.T. Frank, né le 12 février 1777 à Brandebourg-sur-la-Havel et mort le 23 janvier 1843 à Berlin, est un écrivain romantique prussien.",Friedrich Heinrich Karl Motte Baron Fouqué dire Pellegrin Frank naître 12 février 1777 Brandebourg Havel mort 23 janvier 1843 Berlin écrivain romantique prussien,34
167,Charles Lassailly,romantique,"Charles Lassailly, né le 3 septembre 1806 à Orléans et mort le 14 juillet 1843 à Paris,, est un écrivain français.
Classé généralement parmi les « petits romantiques » et les « romantiques frénétiques », comme Philothée O'Neddy ou Xavier Forneret, il est surtout connu comme auteur des Roueries de Trialph.",Charles Lassailly naître 3 septembre 1806 Orléans mort 14 juillet 1843 Paris écrivain français classer généralement parmi petit romantique romantique frénétique comme philothée neddy Xavier Forneret surtout connaître comme auteur rouerie Trialph,34
168,Giacomo Leopardi,romantique,"Giacomo Leopardi, né le 29 juin 1798 à Recanati (États pontificaux) et mort le 14 juin 1837 à Naples (Royaume des Deux Siciles), est un écrivain, poète et philosophe italien, souvent considéré comme le deuxième plus célèbre et influent écrivain italien après Dante Alighieri.
La qualité lyrique de sa poésie lui a donné une influence internationale sur les générations suivantes. Sa méditation métaphysique et lyrique sur le tragique de l'existence en fait un précurseur de Schopenhauer, de Nietzsche, de Freud, de Cioran.
Le débat sur l'œuvre de Leopardi à partir du XXe siècle, notamment par rapport à la pensée existentialiste entre les années 1930 et 1950, a conduit les exégètes à approfondir leur analyse philosophique du contenu et de la signification de ses textes. Bien que rendus surtout dans les œuvres en prose, ils trouvent des correspondances précises au niveau lyrique dans une ligne unitaire d'attitude existentielle. La réflexion philosophique et l'empathie poétique font que Leopardi, comme Schopenhauer, Kierkegaard, Nietzsche et plus tard Kafka, peut être considéré comme un existentialiste ou au moins un précurseur de l'existentialisme. 

",Giacomo Leopardi naître 29 juin 1798 Recanati état pontifical mort 14 juin 1837 Naples Royaume Deux sicile écrivain poète philosophe italien souvent considérer comme deuxième plus célèbre influer écrivain italien après dante Alighieri le qualité lyrique poésie avoir donner influence international génération suivant son méditation métaphysique lyrique tragique existence fait précurseur Schopenhauer Nietzsche Freud Cioran le débat œuvre Leopardi partir xx siècle notamment rapport pensée existentialiste entre année 1930 1950 avoir conduire exégète approfondir analyse philosophique contenu signification texte bien rendre surtout œuvre prose trouver correspondance précis niveau lyrique ligne unitaire attitude existentiel le réflexion philosophique empathie poétique faire Leopardi comme Schopenhauer Kierkegaard nietzsche plus tard Kafka pouvoir être considérer comme existentialiste moins précurseur existentialisme,34
169,Mikhaïl Lermontov,romantique,"Mikhaïl Iourievitch Lermontov (en russe : Михаил Юрьевич Лермонтов), né le 3 octobre 1814 (15 octobre 1814 dans le calendrier grégorien) à Moscou et mort le 15 juillet 1841 (27 juillet 1841 dans le calendrier grégorien) à Piatigorsk, est un poète, peintre, romancier et dramaturge russe, souvent appelé le « poète du Caucase ».",Mikhaïl Iourievitch Lermontov russe Михаил Юрьевич Лермонтов naître 3 octobre 1814 15 octobre 1814 calendrier grégorien Moscou mort 15 juillet 1841 27 juillet 1841 calendrier grégorien Piatigorsk poète peintr romancier dramaturg russe souvent appeler poète caucase,34
170,George Lippard,romantique,"George Lippard, né le 10 avril 1822 à West Nantmeal Township en Pennsylvanie et mort le 9 février 1854 à Philadelphie, est un romancier et dramaturge américain, ami d'Edgar Allan Poe.",george Lippard naître 10 avril 1822 West Nantmeal Township Pennsylvanie mort 9 février 1854 Philadelphie romancier dramaturge américain ami edgar Allan Poe,34
171,Zygmunt Lubicz-Zaleski,romantique,"Zygmunt Lubicz-Zaleski (né Zygmunt Zaleski de la maison Lubicz) est un écrivain, poète, pianiste, universitaire (docteur en philosophie), patriote et diplomate polonais, né à Klonówiec le 29 septembre 1882, mort à Paris le 15 décembre 1967 .
Ami de Ignacy Paderewski, Henryk Sienkiewicz et de nombreux artistes français et polonais, il a joué un rôle actif dans la renaissance d'une Pologne indépendante et dans le développement des relations politiques et culturelles franco-polonaises au XXe siècle. Témoin éclairé de son temps, son œuvre participe à former les esprits à la construction du rêve européen d'un avenir commun bâti sur les cendres des Guerres mondiales,.",zygmunt Lubicz Zaleski né Zygmunt Zaleski maison Lubicz écrivain poète pianist universitaire docteur philosophie patriote diplomate polonais naître Klonówiec 29 septembre 1882 mort Paris 15 décembre 1967 ami Ignacy Paderewski Henryk Sienkiewicz nombreux artiste français polonais avoir jouer rôle actif renaissance pologne indépendant développement relation politique culturelle xx siècle témoin éclairer temps œuvre participe former esprit construction rêve européen avenir commun bâti cendre guerre mondial,34
172,Karel Hynek Mácha,romantique,"Le poète tchèque Karel Hynek Mácha (/ˈkarɛl ˈɦɪnɛk ˈmaːxa/, Karl Ignaz Macha en allemand) naquit le 16 novembre 1810 à Prague, il mourut le 6 novembre 1836 à Litoměřice. Il fut l'un des représentants les plus importants du romantisme tchèque.",le poète tchèque Karel Hynek Mácha ˈɦɪnɛk Karl Ignaz Macha allemand naître 16 novembre 1810 Prague mourir 6 novembre 1836 Litoměřice il représentant plus important romantisme tchèque,34
173,Auguste Maquet,romantique,"Auguste Maquet, né à Paris le 13 septembre 1813 et mort à Sainte-Mesme le 8 janvier 1888, est un romancier et dramaturge français, connu surtout pour sa collaboration avec Alexandre Dumas.",Auguste Maquet naître Paris 13 septembre 1813 mort 8 janvier 1888 romancier dramaturg français connaître surtout collaboration Alexandre Dumas,34
